{
    "$schema": "http://json-schema.org/draft-04/schema#",
    "description": "Project Template Catalogue Schema",
    "definitions": {
        "SimpleTemplateDescriptor": {
            "type": "object",
            "properties": {
                "@type": {
                    "type": "string"
                },
                "fullyQualifiedName": {
                    "type": "string"
                },
                "name": {
                    "type": "string",
                    "pattern": "^[A-Za-z_][A-Za-z0-9_]*$"
                },
                "package": {
                    "type": "string",
                    "pattern": "^(?:([A-Za-z_][A-Za-z0-9_]*)(?:\\.[A-Za-z_][A-Za-z0-9_]*)*|https?:\\/\\/\\S+)$"
                },
                "template": {
                    "type": "string"
                },
                "cbindings": {
                    "type": "string"
                }
            },
            "required": [
                "@type",
                "fullyQualifiedName",
                "name",
                "template",
                "package",
                "cbindings"
            ],
            "additionalProperties": false
        },
        "CompositeTemplateDescriptor": {
            "type": "object",
            "properties": {
                "@type": {
                    "type": "string"
                },
                "fullyQualifiedName": {
                    "type": "string"
                },
                "name": {
                    "type": "string"
                },
                "package": {
                    "type": "string"
                },
                "consistsOf": {
                    "type": "string"
                },
                "sharing": {
                    "type": "array",
                    "items": [
                        {
                            "type": "string"
                        },
                        {
                            "type": "string"
                        }
                    ]
                }
            },
            "required": [
                "@type",
                "fullyQualifiedName",
                "name",
                "package",
                "consistsOf",
                "sharing"
            ],
            "additionalProperties": false
        },
        "TemplateDescriptor": {
            "anyOf": [
                {
                    "$ref": "#/definitions/SimpleTemplateDescriptor"
                },
                {
                    "$ref": "#/definitions/CompositeTemplateDescriptor"
                }
            ]
        },
        "TableDescriptor": {
            "type": "object",
            "properties": {
                "id": {
                    "type": "string"
                },
                "serial": {
                    "type": "string"
                },
                "created_at": {
                    "type": "string"
                }
            },
            "required": [
                "id",
                "created_at"
            ],
            "additionalProperties": false
        },
        "GeneratorDescriptor": {
            "type": "object",
            "properties": {
                "id": {
                    "type": "string"
                },
                "class": {
                    "type": "string"
                },
                "parameters": {
                    "type": "object"
                },
                "classpath": {
                    "type": "array",
                    "items": [
                        {
                            "type": "string"
                        }
                    ]
                }
            },
            "required": [
                "class"
            ],
            "additionalProperties": false
        }
    },
    "type": "object",
    "properties": {
        "group": {
            "type": "string"
        },
        "name": {
            "type": "string"
        },
        "destination": {
            "type": "string"
        },
        "description": {
            "type": "string"
        },
        "version": {
            "type": "string"
        },
        "root_package": {
            "type": "string"
        },
        "script": {
            "type": "string"
        },
        "script_dir": {
            "type": "string"
        },
        "python_dir": {
            "type": "string"
        },
        "javascript_dir": {
            "type": "string"
        },
        "rust_dir": {
            "type": "string"
        },
        "integrator": {
            "type": "boolean"
        },
        "jsweet": {
            "type": "boolean"
        },
        "jsonschema": {
            "type": "string"
        },
        "documentation": {
            "type": "string"
        },
        "variableCheck": {
            "type": "string"
        },
        "sqlFile": {
            "type": "string"
        },
        "templates": {
            "type": "array",
            "items": [
                {
                    "$ref": "#/definitions/TemplateDescriptor"
                }
            ]
        },
        "search": {
            "type": "array",
            "items": [
                {
                    "type": "string"
                }
            ]
        },
        "sql.tables": {
            "type": "object",
            "patternProperties": {
                "^(.*)$": {
                    "$ref": "#/definitions/TableDescriptor"
                }
            }
        },
        "past-generators": {
            "type": "object",
            "patternProperties": {
                "^(.*)$": {
                    "$ref": "#/definitions/GeneratorDescriptor"
                }
            }
        }
    },
    "required": [
        "group",
        "name",
        "destination",
        "description",
        "version",
        "root_package",
        "script",
        "script_dir",
        "jsweet",
        "jsonschema",
        "documentation",

        "templates"
    ],
    "additionalProperties": false
}