{
    "group": "org.openprovenance.prov",
    "name": "template_library",
    "destination": "target",
    "description": "PROV templates for plead ML pipeline",
    "version": "0.1.0",
    "root_package": "org.openprovenance.prov.template.library.plead",
    "search": ["activity", "file", "agent", "method", "score", "approval_record"],
    "script": "ptm_plead_run",
    "script_dir": "target/bin",
    "python_dir": "target/generated-python",
    "integrator": true,
    "jsweet": true,
    "jsonschema": "schema-plead.json",
    "documentation": "doc-plead.html",
    "sqlFile": "prov-template-library-plead.sql",
    "templates" : [

        {
            "@type": "simple",
            "fullyQualifiedName": "org.openprovenance.prov.template.library.plead.PleadTransforming",
            "name": "plead_transforming",
            "package": "org.openprovenance.prov.template.library.plead",
            "template": "org/openprovenance/prov/templates/plead/plead-transforming",
            "cbindings": "org/openprovenance/prov/templates/plead/plead-transforming.json"
        },

        {
            "@type": "simple",
            "fullyQualifiedName": "org.openprovenance.prov.template.library.plead.PleadFiltering",
            "name": "plead_filtering",
            "package": "org.openprovenance.prov.template.library.plead",
            "template": "org/openprovenance/prov/templates/plead/plead-filtering",
            "cbindings": "org/openprovenance/prov/templates/plead/plead-filtering.json"
        },
        {
            "@type": "simple",
            "fullyQualifiedName": "org.openprovenance.prov.template.library.plead.PleadTraining",
            "name": "plead_training",
            "package": "org.openprovenance.prov.template.library.plead",
            "template": "org/openprovenance/prov/templates/plead/plead-training",
            "cbindings": "org/openprovenance/prov/templates/plead/plead-training.json"
        },
        {
            "@type": "simple",
            "fullyQualifiedName": "org.openprovenance.prov.template.library.plead.PleadValidating",
            "name": "plead_validating",
            "package": "org.openprovenance.prov.template.library.plead",
            "template": "org/openprovenance/prov/templates/plead/plead-validating",
            "cbindings": "org/openprovenance/prov/templates/plead/plead-validating.json"
        },
        {
            "@type": "simple",
            "fullyQualifiedName": "org.openprovenance.prov.template.library.plead.PleadApproving",
            "name": "plead_approving",
            "package": "org.openprovenance.prov.template.library.plead",
            "template": "org/openprovenance/prov/templates/plead/plead-approving",
            "cbindings": "org/openprovenance/prov/templates/plead/plead-approving.json"
        },
        {
            "@type": "simple",
            "fullyQualifiedName": "org.openprovenance.prov.template.library.plead.PleadSplitting",
            "name": "plead_splitting",
            "package": "org.openprovenance.prov.template.library.plead",
            "template": "org/openprovenance/prov/templates/plead/plead-splitting",
            "cbindings": "org/openprovenance/prov/templates/plead/plead-splitting.json"
        },

        {
            "@type": "composite",
            "fullyQualifiedName": "org.openprovenance.prov.template.library.plead.PleadTransformingComposite",
            "name": "plead_transforming_composite",
            "package": "org.openprovenance.prov.template.library.plead",
            "consistsOf": "org.openprovenance.prov.template.library.plead.PleadTransforming",
            "sharing": ["transformed_file", "transforming"]
        }
    ],
    "sql.tables":  {
        "file": {
            "id": "SERIAL",
            "created_at": "timestamp with time zone NOT NULL DEFAULT NOW()"
        },
        "agent": {
            "id": "SERIAL",
            "created_at": "timestamp with time zone NOT NULL DEFAULT NOW()"
        },
        "score": {
            "id": "SERIAL",
            "created_at": "timestamp with time zone NOT NULL DEFAULT NOW()"
        },
        "approval_record": {
            "id": "SERIAL",
            "created_at": "timestamp with time zone NOT NULL DEFAULT NOW()"
        },
        "activity": {
            "id": "SERIAL",
            "created_at": "timestamp with time zone NOT NULL DEFAULT NOW()"
        },
        "method": {
            "id": "SERIAL",
            "serial": "INT",
            "created_at": "timestamp with time zone NOT NULL DEFAULT NOW()"
        }
    }
}
