{
    "group": "org.example",
    "name": "templates",
    "destination": "target/libs",
    "description": "PROV template demo",
    "version": "0.1.0",
    "script": "example_run",
    "root_package": "org.example.templates.catalogue",
    "script_dir": "target/libs/bin",
    "python_dir": "target/libs/python",
    "jsweet": true,
    "jsonschema": "schema.json",
    "sqlFile": "template.sql",
    "documentation": "doc.html",
    "templates" : [
        {
            "@type": "simple",
            "fullyQualifiedName": "org.example.TemplateBlock",
            "name": "template_block",
            "package": "org.example.templates.block",
            "template": "src/test/resources/templates3/generic_binaryop.provn",
            "cbindings": "src/test/resources/templates3/generic_binaryop_b1.json",
            "interfaces": {
                "plain":  ["java.io.Serializable"],
                "input":  ["java.io.Serializable"],
                "output": ["java.io.Serializable"]
            }
        }
    ]
}
